index,sequence_id,segment_id_sequence_start,segment_id_sequence_end,summary,title,segment_start_timestamp,segment_end_timestamp,segment_start_timestamp_in_seconds,segment_end_timestamp_in_seconds,video_id,activity_type,activity_reasoning,target_person_type,target_person_reasoning,activity,Moment_url
vi18qSrl7wIdeYOKuDg7YQBx_Feedback_1,1,4,5,"Kareem expresses the need to validate areas where they can assist, emphasizing the importance of Doctor Harvey's input and the need for an interactive session to engage him effectively.",Engaging Doctor Harvey's Input,07:07.860,08:04.900,427,484,vi18qSrl7wIdeYOKuDg7YQBx,Guidance,"Kanishka Rao is providing specific suggestions on how to structure the presentation slides, indicating they are offering advice and direction to help improve the presentation strategy.",Giving Feedback,"Kanishka Rao is the primary person giving feedback in this case because they directly suggest building up a slide and provide specific guidance on how to present the information, indicating they are actively giving feedback on the presentation strategy.",Feedback,https://embed.api.video/vod/vi18qSrl7wIdeYOKuDg7YQBx#;t=427
vi18qSrl7wIdeYOKuDg7YQBx_Feedback_2,2,8,10,"Kareem and Kanishka discuss the necessity of an executive summary for the presentation, with Kanishka advocating for its inclusion to facilitate the conversation.",Importance of Executive Summary,08:42.386,09:02.826,522,542,vi18qSrl7wIdeYOKuDg7YQBx,Guidance,"Kanishka Rao is providing guidance by suggesting the need for an executive summary to facilitate the conversation, indicating a direction for the team to follow.",Giving Feedback,"Kanishka Rao is giving feedback by stating 'I think we should have one, just to start the conversation so he knows what's up...' which indicates he is providing his perspective and guidance on the need for an executive summary.",Feedback,https://embed.api.video/vod/vi18qSrl7wIdeYOKuDg7YQBx#;t=522
vi18qSrl7wIdeYOKuDg7YQBx_Feedback_3,3,11,13,"Kanishka emphasizes the need for a level-setting slide to clarify their mission and objectives before diving into the agenda, ensuring Doctor Harvey understands their purpose.",Clarifying Mission and Objectives,09:35.986,10:04.196,575,604,vi18qSrl7wIdeYOKuDg7YQBx,Guidance,"Kanishka Rao is providing guidance on how to structure the meeting by suggesting a level-setting slide and emphasizing the importance of communicating the mission and purpose, which helps direct the flow of the meeting.",Giving Feedback,"Kanishka Rao is providing feedback on the meeting structure and context by suggesting a level-setting slide and emphasizing the importance of communicating the mission and purpose of the meeting, indicating he is the primary actor in this interaction.",Feedback,https://embed.api.video/vod/vi18qSrl7wIdeYOKuDg7YQBx#;t=575
vi18qSrl7wIdeYOKuDg7YQBx_Feedback_4,4,17,19,"Kareem and Kanishka discuss the presentation's content, focusing on the areas they will assist with and the importance of highlighting specific scopes of work.",Highlighting Scope of Work,12:40.606,13:00.516,760,780,vi18qSrl7wIdeYOKuDg7YQBx,Guidance,"Kanishka Rao is providing guidance by suggesting a specific action to improve the presentation, stating 'Duplicate the slide and have a second version with the highlighted sort of scope.' This indicates he is offering advice on how to enhance the work.",Giving Feedback,"Kanishka Rao is giving feedback by suggesting a specific action to improve the presentation, stating 'Duplicate the slide and have a second version with the highlighted sort of scope.' This indicates he is providing guidance on how to enhance the work.",Feedback,https://embed.api.video/vod/vi18qSrl7wIdeYOKuDg7YQBx#;t=760
vi18qSrl7wIdeYOKuDg7YQBx_Feedback_5,5,51,53,"Kanishka and Kareem discuss the need to prepare for potential questions regarding their model's cost and effectiveness, ensuring they are ready to address concerns about their services.",Preparing for Cost and Effectiveness Questions,18:05.399,18:23.883,1085,1103,vi18qSrl7wIdeYOKuDg7YQBx,Suggestion,"Kanishka Rao suggests moving a slide ahead in the presentation order, indicating a proposed change without direct criticism.",Giving Feedback,"Kanishka Rao is the primary person giving feedback in this case because they directly state 'the bar I feel strongly about, Kareem, is let's move that slide I proposed ahead of slide 13,' indicating a suggestion for improvement regarding the presentation order.",Feedback,https://embed.api.video/vod/vi18qSrl7wIdeYOKuDg7YQBx#;t=1085
vi3MC0JsaO4n4cA7cYgYzpb4_Feedback_1,1,12,25,"Sriram provides updates on meetings and discusses the importance of moving forward with Temple and MUSC, while Bharat emphasizes the need for careful communication regarding project delays.",Updates on Meetings and Strategy,02:26.420,05:50.953,146,350,vi3MC0JsaO4n4cA7cYgYzpb4,Guidance,"Kanishka Rao suggests scheduling a meeting to discuss how to incentivize the two individuals involved, indicating he is providing guidance on the next steps and emphasizing the urgency of the situation.",Giving Feedback,"Kanishka Rao is giving feedback in this case as he suggests scheduling a meeting to discuss how to incentivize the two individuals involved, indicating he is providing guidance on the next steps and emphasizing the urgency of the situation.",Feedback,https://embed.api.video/vod/vi3MC0JsaO4n4cA7cYgYzpb4#;t=146
vi3MC0JsaO4n4cA7cYgYzpb4_Feedback_2,2,26,30,"Bharat expresses concerns about relying on Tim for timing, while Sriram reassures that the timing is under their control, leading to a discussion on how to address potential issues.",Concerns About Project Timing,05:51.453,06:48.036,351,408,vi3MC0JsaO4n4cA7cYgYzpb4,Not Feedback,"Kanishka Rao is not mentioned in the interaction, and there is no indication of their involvement in the discussion.",Not Involved,"Kanishka Rao is not mentioned in the interaction, and there is no indication of their involvement in the discussion.",Feedback,https://embed.api.video/vod/vi3MC0JsaO4n4cA7cYgYzpb4#;t=351
